{
  "schema_version": "1.0",
  "node_id": "lld-v1-schema",
  "grain": "module",
  "purpose": "Defines the frozen lld.v1 ModuleBrief/FreezeRecord shape and hand-mirrored TS+Python+Rust validators shared by downstream features.",
  "owner": "rachit@devxlabs.ai",
  "owner_path": "apps/mobile/src/build/",
  "interface": [
    { "name": "validateModuleBrief", "signature": "(input: unknown) => ValidationResult" },
    { "name": "canonicalJson", "signature": "(value: unknown) => string" },
    { "name": "contentHash", "signature": "(value: unknown) => string" }
  ],
  "data_owned": [],
  "deps": ["orb-freeze-ledger"],
  "registry": {
    "kind": "build_new",
    "searched": ["registry/services/llm-gateway", "registry/features/cost-control-plane"]
  },
  "acceptance": {
    "given": "a ModuleBrief fixture on disk",
    "when": "validateModuleBrief and validate_module_brief and validate_module_brief (rust) all parse it",
    "then": "apps/mobile/src/build/lld-v1.ts's validator agrees with the Python and Rust mirrors on the same verdict",
    "oracle_kind": "test",
    "artifact": "apps/mobile/src/build/lld-v1.ts"
  },
  "non_goals": [
    "Does not implement an ajv or JSON-Schema-runtime validator",
    "Does not implement the lld-ready gate's business-rule checks (that is a separate unit)"
  ],
  "open_questions": [],
  "guarantees": [
    {
      "claim": "the schema never lets a proposer author an authority field",
      "derivation": {
        "kind": "structural",
        "invariant": "ModuleBrief has no content_hash/freeze_id/depth_evidence/stamped_by/state/version field",
        "enforced_by": "apps/mobile/src/build/lld-v1.ts"
      },
      "label": "kills_structural"
    },
    {
      "claim": "content_hash is stable across field reordering",
      "derivation": {
        "kind": "number",
        "value": "100",
        "calc": "100 key-order shuffles produced 1 distinct hash = 100/100 stable"
      },
      "label": "kills_mechanical"
    }
  ],
  "alternatives": [
    {
      "option": "adopt ajv for JSON-Schema-backed runtime validation",
      "why_killed": "adds a runtime dependency no package.json here lists and no other Orb module uses yet",
      "revive_trigger": "a second consumer needs full draft-07 keyword support beyond hand-written field checks"
    },
    {
      "option": "generate the Python/Rust validators from the JSON Schema at build time",
      "why_killed": "no codegen step exists in this repo's build; a hand-mirror plus the cross-language comparator is the smaller diff",
      "revive_trigger": "F35 (contract-codegen pipeline) lands"
    }
  ],
  "failure_story": {
    "trigger": "the Python, TypeScript, and Rust validators drift after an edit lands in only one of them",
    "blast_radius": "the client accepts a brief the relay or fleet silently rejects, or vice versa, and a freeze attempt fails opaquely deep in the pipeline",
    "fail_safe": "lld-crosslang.sh runs all three validators against the same fixture corpus on every verify and exits 6 loud on any mismatch"
  }
}
