{
  "schema_version": "1.0",
  "node_id": "status-echo-formatter",
  "grain": "leaf",
  "purpose": "A single-path helper that formats a lane's status line for the swarm meter.",
  "owner": "rachit@devxlabs.ai",
  "owner_path": "apps/mobile/src/build/",
  "interface": [
    { "name": "formatStatusEcho", "signature": "(lane: LaneStatus) => string" }
  ],
  "data_owned": [],
  "deps": [],
  "registry": {
    "kind": "build_new",
    "searched": ["registry/services/llm-gateway", "registry/features/cost-control-plane"]
  },
  "acceptance": {
    "given": "a LaneStatus value",
    "when": "formatStatusEcho renders it",
    "then": "apps/mobile/src/build/StatusEcho.ts's formatter produces a one-line, human-readable string",
    "oracle_kind": "test",
    "artifact": "apps/mobile/src/build/StatusEcho.ts"
  },
  "non_goals": ["Does not compute the lane's state, only renders an already-computed one"],
  "open_questions": [],
  "guarantees": [
    {
      "claim": "the formatter never throws on a well-typed LaneStatus",
      "derivation": {
        "kind": "structural",
        "invariant": "formatStatusEcho is a total function over the closed LaneStatus union",
        "enforced_by": "apps/mobile/src/build/StatusEcho.ts"
      },
      "label": "kills_structural"
    }
  ],
  "alternatives": [
    {
      "option": "reuse the swarm console's own Rust-side status renderer via an FFI call",
      "why_killed": "this module runs client-side in Metro/RN, which cannot call into the fleet Rust binary",
      "revive_trigger": "the client ever gains a native bridge to fleet's binary"
    }
  ],
  "failure_story": {
    "trigger": "a LaneStatus variant is added upstream without updating this formatter's switch",
    "blast_radius": "the new state renders as an empty or garbled line in the swarm meter, confusing whoever is watching it",
    "fail_safe": "a TypeScript exhaustiveness check on the switch fails the build the moment a variant is unhandled"
  }
}
